<?xml version="1.0" encoding="UTF-8"?>
<!DOCTYPE statements SYSTEM "sequencedescription.dtd">
<statements>

	<execute statement="create schema [USER]S2"/>
	<execute statement="rollback"/>

	<execute statement="inner transaction begin"/>
	<execute statement="create table [USER]S2.TAB (ID integer primary key, NAME char(20))" error="-4030"/>
	<execute statement="insert [USER]S2.TAB values (1,'n1')" error="-4004"/>
	<execute statement="inner transaction rollback"/>

	<execute statement="select * from [USER]S2.TAB" error="-4004"/>

	<execute statement="commit"/>

</statements>