<?xml version="1.0" encoding="UTF-8"?>
<!DOCTYPE statements SYSTEM "sequencedescription.dtd">
<statements>

	<execute statement="create table TAB (ID integer primary key,NAME char(20))"/>

	<execute statement="commit"/>

	<execute statement="inner transaction begin"/>

	<execute statement="insert TAB values(1,'n1')"/>
	<execute statement="insert TAB values(2,'n2')"/>

	<execute statement="insert TAB values(3,'n3') with commit"/>
	<execute statement="insert TAB values(4,'n4') with commit"/>

	<execute statement="insert TAB values(5,'n5')"/>
	<execute statement="insert TAB values(6,'n6')"/>

	<execute statement="inner transaction commit"/>

	<execute statement="insert TAB values(7,'n7')"/>
	<execute statement="insert TAB values(8,'n8')"/>

	<execute statement="commit"/>	

	<check select="select * from TAB" result="([ID:integer, NAME:char]), (1,'n1'), (2,'n2'), (3,'n3'), (4,'n4'), (5,'n5'), (6,'n6'), (7,'n7'), (8,'n8')"/>

	<execute statement="commit"/>	

</statements>