<?xml version="1.0" encoding="UTF-8"?>
<!DOCTYPE statements SYSTEM "sequencedescription.dtd">
<statements>

	<execute statement="create table TAB (ID integer primary key, NAME char(20))"/>
	<execute statement="commit"/>
	<execute statement="create synonym BATMAN for TAB"/>
	<execute statement="rollback"/>

	<execute statement="inner transaction begin"/>
	<execute statement="insert BATMAN values(1,'Mueller')" error="-4004"/>
	<execute statement="insert TAB values(1,'Mueller')"/>
	<execute statement="inner transaction rollback"/>

	<execute statement="insert TAB values(2,'Mueller')"/>

	<check select="select * from TAB" result="([ID:integer, NAME:char]), (2,'Mueller')"/>
	<execute statement="select * from BATMAN" error="-4004"/>

	<execute statement="commit"/>

</statements>