<?xml version="1.0" encoding="UTF-8"?>
<!DOCTYPE statements SYSTEM "sequencedescription.dtd">
<statements>

	<cleanUp statement="drop user BUGSBUNNY1"/>
	<cleanUp statement="drop user BUGSBUNNY2"/>
	<cleanUp statement="drop user BUGSBUNNY3"/>
	<cleanUp statement="drop user BUGSBUNNY4"/>
	<cleanUp statement="drop user BUGSBUNNY5"/>
	<cleanUp statement="drop user BBUGSBUNNY6"/>

	<cleanUp statement="drop user COYOTE5"/>
	<cleanUp statement="drop user COYOTE6"/>

	<cleanUp statement="commit"/>	

</statements>