<?xml version="1.0" encoding="UTF-8"?>
<!DOCTYPE statements SYSTEM "sequencedescription.dtd">
<statements>

	<execute statement="create table TAB (ID integer primary key,NAME char(20))"/>

	<execute statement="inner transaction begin"/>
	<execute statement="rename table TAB to BAT" error="500"/>
	<execute statement="inner transaction rollback"/>

	<execute statement="insert BAT values(1,'n1')" error="-4004"/>

	<execute statement="insert TAB values(2,'n2')"/>

	<check select="select * from TAB" result="([ID:integer,NAME:char]),(2,'n2')"/>
	<execute statement="commit"/>

</statements>