<?xml version="1.0" encoding="UTF-8"?>
<!DOCTYPE statements SYSTEM "sequencedescription.dtd">
<statements>

	<!-- test -->
	<execute statement="create usergroup MOPPELPOPPEL11"/>
	<execute statement="rollback"/>

	<execute statement="inner transaction begin"/>
	<execute statement="grant usergroup MOPPELPOPPEL11 TO PETERUWE12" error="-4013"/>
	<execute statement="inner transaction rollback"/>

	<sync/>

	<execute statement="drop usergroup MOPPELPOPPEL12" error="-4013"/>
	<execute statement="commit"/>

	<!-- cleanUp -->
	<cleanUp statement="drop usergroup MOPPELPOPPEL11"/>
	<cleanUp statement="commit"/>

</statements>