<?xml version="1.0" encoding="UTF-8"?>
<!DOCTYPE statements SYSTEM "sequencedescription.dtd">
<statements>

	<execute statement="create table TAB (ID integer primary key,NAME char(20) default 'Hansi')"/>
	<execute statement="commit"/>

	<execute statement="inner transaction begin"/>
	<execute statement="rename column TAB.ID to NUMBER"/>
	<execute statement="inner transaction commit"/>

	<execute statement="insert TAB (NUMBER) values(1)"/>

	<execute statement="insert TAB (ID) values(1)" error="-4005"/>

	<check select="select * from TAB" result="([NUMBER:integer, NAME:char]),(1,'Hansi')"/>
	<execute statement="commit"/>

</statements>