<?xml version="1.0" encoding="UTF-8"?>
<!DOCTYPE statements SYSTEM "sequencedescription.dtd">
<statements>

	<!-- prepare -->
	<execute statement="create user [USER]Z1 password PUPS"/>
	<execute statement="create role [USER]Z"/>

	<!-- test -->
	<execute statement="inner transaction begin"/>
	<execute statement="grant [USER]Z to [USER]Z1" error="500"/>
	<execute statement="inner transaction commit"/>

	<execute statement="commit"/>

	<!-- clean up -->	
	<cleanUp statement="commit"/>
	<cleanUp statement="drop user [USER]Z1"/>
	<cleanUp statement="drop role [USER]Z"/>
	<cleanUp statement="commit"/>

</statements>