<?xml version="1.0" encoding="UTF-8"?>
<!DOCTYPE statements SYSTEM "sequencedescription.dtd">
<statements>

	<!-- test -->
	<execute statement="create usergroup [USER]UG"/>
	<execute statement="rollback"/>

	<execute statement="inner transaction begin"/>
	<execute statement="drop usergroup [USER]UG" error="-4013"/>
	<execute statement="inner transaction rollback"/>

	<execute statement="create user [USER]UG1 password PUPS usergroup [USER]UG" error="-4013"/>
	<execute statement="commit"/>

	<!-- clean up -->	
	<cleanUp statement="drop user [USER]UG1"/>
	<cleanUp statement="drop usergroup [USER]UG"/>
	<cleanUp statement="commit"/>

</statements>