<?xml version="1.0" encoding="UTF-8"?>
<!DOCTYPE statements SYSTEM "sequencedescription.dtd">
<statements>

	<!-- test -->
	<execute statement="create usergroup KINDERGARTEN3 RESOURCE"/>
	<execute statement="rollback"/>

	<execute statement="inner transaction begin"/>
	<execute statement="alter usergroup KINDERGARTEN3 STANDARD" error="-4013"/>
	<execute statement="inner transaction rollback"/>

	<execute statement="create user HACKBERT3 password PUPS usergroup KINDERGARTEN3" error="-4013"/>
	<execute statement="commit"/>

</statements>