<?xml version="1.0" encoding="UTF-8"?>
<!DOCTYPE statements SYSTEM "sequencedescription.dtd">
<statements>

	<!-- test -->
	<execute statement="create sequence MOPPELPOPPEL30 increment by 2 start with 3"/>
	<execute statement="rollback"/>

	<execute statement="inner transaction begin"/>
	<execute statement="grant select on MOPPELPOPPEL30 TO PETERUWE29" error="-4004"/>
	<execute statement="inner transaction commit"/>

	<sync/>

	<execute statement="create table TAB(ID integer primary key, NAME char(20))"/>
	<execute statement="insert TAB values (PETERUWE29.MOPPELPOPPEL29.nextval,'name')" error="-4020"/>
	
	<execute statement="commit"/>

	<!-- cleanUp -->
	<cleanUp statement="drop sequence MOPPELPOPPEL30"/>
	<cleanUp statement="commit"/>

</statements>