<?xml version="1.0" encoding="UTF-8"?>
<!DOCTYPE statements SYSTEM "sequencedescription.dtd">
<statements>

	<!-- test -->
	<execute statement="create sequence MOPPELPOPPEL28 increment by 2 start with 3"/>
	<execute statement="commit"/>

	<execute statement="inner transaction begin"/>
	<execute statement="grant select on MOPPELPOPPEL28 TO PETERUWE27"/>
	<execute statement="inner transaction rollback"/>

	<sync/>

	<execute statement="create table TAB(ID integer primary key, NAME char(20))"/>
	<execute statement="insert TAB values (PETERUWE27.MOPPELPOPPEL27.nextval,'name')" error="-4020"/>
	
	<execute statement="commit"/>

	<!-- cleanUp -->
	<cleanUp statement="drop sequence MOPPELPOPPEL28"/>
	<cleanUp statement="commit"/>

</statements>