<?xml version="1.0" encoding="UTF-8"?>
<!DOCTYPE statements SYSTEM "sequencedescription.dtd">
<statements>

	<!-- test -->
	<execute statement="create schema MOPPELPOPPEL23"/>
	<execute statement="rollback"/>

	<execute statement="inner transaction begin"/>
	<execute statement="grant createin on MOPPELPOPPEL23 TO PETERUWE24" error="-4030"/>
	<execute statement="inner transaction commit"/>

	<sync/>

	<execute statement="create table MOPPELPOPPEL24.TAB (ID integer primary key, NAME char(20))" error="-4030"/>
	<execute statement="commit"/>

	<!-- cleanUp -->
	<cleanUp statement="drop schema MOPPELPOPPEL23"/>
	<cleanUp statement="commit"/>

</statements>