<?xml version="1.0" encoding="UTF-8"?>
<!DOCTYPE statements SYSTEM "sequencedescription.dtd">
<statements>

	<execute statement="create table TAB1 (ID integer primary key,NAME char(20))"/>

	<execute statement="inner transaction rollback" error="-7065"/>

	<execute statement="rename column TAB1.NAME to SURNAME"/>

	<execute statement="insert TAB1 values(1,'n1')"/>
	<execute statement="insert TAB1 values(2,'n2')"/>

	<check select="select * from TAB1" result="([ID:integer, SURNAME:char]), (1,'n1'), (2,'n2')"/>

	<execute statement="commit"/>	

</statements>