<?xml version="1.0" encoding="UTF-8"?>
<!DOCTYPE statements SYSTEM "sequencedescription.dtd">
<statements>

	<!-- test -->
	<execute statement="create sequence MOPPELPOPPEL46 increment by 2 start with 3"/>
	<execute statement="grant select on MOPPELPOPPEL46 TO PETERUWE45"/>
	<execute statement="commit"/>

	<execute statement="inner transaction begin"/>
	<execute statement="revoke select on MOPPELPOPPEL46 from PETERUWE45"/>
	<execute statement="inner transaction rollback"/>

	<sync/>

	<execute statement="create table TAB(ID integer primary key, NAME char(20))"/>
	<execute statement="insert TAB values (PETERUWE45.MOPPELPOPPEL45.nextval,'name')"/>
	<execute statement="insert TAB values (1,'name')"/>

	<check select="select * from TAB" result="([ID:integer, NAME:char]), (1,'name'), (3,'name')"/>
	<execute statement="commit"/>

	<!-- cleanUp -->
	<cleanUp statement="drop sequence MOPPELPOPPEL46"/>
	<cleanUp statement="commit"/>

</statements>