<?xml version="1.0" encoding="UTF-8"?>
<!DOCTYPE statements SYSTEM "sequencedescription.dtd">
<statements>

	<execute statement="commit"/>
	<execute statement="create user YOGIBAER5 password PUPS resource"/>
	<execute statement="rollback"/>

	<execute statement="inner transaction begin"/>
	<execute statement="alter user YOGIBAER5 standard" error="-4003"/>

	<execute statement="inner transaction commit"/>	
	<execute statement="commit"/>	

</statements>