<?xml version="1.0" encoding="UTF-8"?>
<!DOCTYPE statements SYSTEM "sequencedescription.dtd">
<statements>

	<cleanUp statement="drop user BIENEMAJA1"/>
	<cleanUp statement="drop user BIENEMAJA2"/>
	<cleanUp statement="drop user BIENEMAJA3"/>
	<cleanUp statement="drop user BIENEMAJA4"/>
	<cleanUp statement="drop user BIENEMAJA5"/>
	<cleanUp statement="drop user BIENEMAJA6"/>


	<cleanUp statement="drop user WILLI1"/>
	<cleanUp statement="drop user WILLI2"/>
	<cleanUp statement="drop user WILLI3"/>
	<cleanUp statement="drop user WILLI4"/>
	<cleanUp statement="drop user WILLI5"/>
	<cleanUp statement="drop user WILLI6"/>

	<cleanUp statement="commit"/>	

</statements>