<?xml version="1.0" encoding="UTF-8"?>
<!DOCTYPE statements SYSTEM "sequencedescription.dtd">
<statements>
	<execute statement="create domain SURNAME char(20) default 'Meier'"/>
	<execute statement="commit"/>

	<execute statement="inner transaction begin"/>
	<execute statement="create table TAB (ID integer primary key, NAME SURNAME)"/>
	<execute statement="inner transaction rollback"/>

	<execute statement="insert TAB values (1,'Mueller')" error="-4004"/>
	<execute statement="commit"/>

</statements>