<?xml version="1.0" encoding="UTF-8"?>
<!DOCTYPE statements SYSTEM "sequencedescription.dtd">
<statements>

	<execute statement="create table TAB (ID integer primary key, NAME char(20), SURNAME char(20))"/>
	<execute statement="commit"/>
	<execute statement="create unique index NAME_INDEX on TAB (NAME ASC, SURNAME DESC)"/>
	<execute statement="rollback"/>

	<execute statement="inner transaction begin"/>
	<execute statement="rename index NAME_INDEX on TAB to INDEX_NAME" error="-4011"/>
	<execute statement="inner transaction commit"/>

	<check select="select * from DOMAIN.INDEXES where SCHEMANAME = '[USER]' AND OWNER = '[USER]' AND TABLENAME = 'TAB' AND INDEXNAME = 'INDEX_NAME'" result="0"/>
	<check select="select * from DOMAIN.INDEXES where SCHEMANAME = '[USER]' AND OWNER = '[USER]' AND TABLENAME = 'TAB' AND INDEXNAME = 'NAME_INDEX'" result="0"/>
	
	<execute statement="commit"/>

</statements>