<?xml version="1.0" encoding="UTF-8"?>
<!DOCTYPE statements SYSTEM "sequencedescription.dtd">
<statements>

	<execute statement="create table TAB (ID integer primary key, NAME char(20))"/>
	<execute statement="create synonym BATMAN for TAB"/>
	<execute statement="commit"/>

	<execute statement="inner transaction begin"/>
	<execute statement="drop synonym BATMAN"/>
	<execute statement="inner transaction commit"/>

	<execute statement="insert BATMAN values(1,'Mueller')" error="-4004"/>
	<execute statement="insert TAB values(1,'Mueller')"/>

	<check select="select * from TAB" result="([ID:integer, NAME:char]),(1,'Mueller')"/>

	<execute statement="commit"/>

</statements>