<?xml version="1.0" encoding="UTF-8"?>
<!DOCTYPE statements SYSTEM "sequencedescription.dtd">
<statements>

	<!-- test -->
	<execute statement="create schema MOPPELPOPPEL42"/>
	<execute statement="commit"/>
	<execute statement="grant createin on MOPPELPOPPEL42 TO PETERUWE41"/>
	<execute statement="rollback"/>

	<execute statement="inner transaction begin"/>
	<execute statement="revoke createin on MOPPELPOPPEL42 from PETERUWE41"/>
	<execute statement="inner transaction commit"/>

	<sync/>

	<execute statement="create table MOPPELPOPPEL41.TAB (ID integer primary key, NAME char(20))" error="-5001"/>
	<execute statement="commit"/>

	<!-- cleanUp -->
	<cleanUp statement="drop schema MOPPELPOPPEL42"/>
	<cleanUp statement="commit"/>

</statements>