<?xml version="1.0" encoding="UTF-8"?>
<!DOCTYPE statements SYSTEM "sequencedescription.dtd">
<statements>

	<cleanUp statement="drop user HACKBERT1"/>
	<cleanUp statement="drop user HACKBERT2"/>
	<cleanUp statement="drop user HACKBERT3"/>
	<cleanUp statement="drop user HACKBERT4"/>

	<cleanUp statement="drop usergroup KINDERGARTEN1"/>
	<cleanUp statement="drop usergroup KINDERGARTEN2"/>
	<cleanUp statement="drop usergroup KINDERGARTEN3"/>
	<cleanUp statement="drop usergroup KINDERGARTEN4"/>

	<cleanUp statement="commit"/>	

</statements>