<?xml version="1.0" encoding="UTF-8"?>
<!DOCTYPE statements SYSTEM "sequencedescription.dtd">
<statements>

	<!-- test -->
	<execute statement="create user MOPPELPOPPEL6 password PUPS standard"/>
	<execute statement="rollback"/>

	<execute statement="inner transaction begin"/>
	<execute statement="grant user MOPPELPOPPEL6 TO PETERUWE5" error="-4003"/>
	<execute statement="inner transaction commit"/>

	<sync/>

	<execute statement="drop user MOPPELPOPPEL5" error="-4003"/>
	<execute statement="commit"/>

	<!-- cleanUp -->
	<cleanUp statement="drop user MOPPELPOPPEL6"/>
	<cleanUp statement="commit"/>

</statements>